,Unnamed: 0,journalname,pmid,text,response
11428,121499,Revista da Escola de Enfermagem da U S P,28355317,anxiety music head neckoutpatient clinic objective evaluating effectiveness musical intervention reducing anxiety vital parameters people suffering head neck method head neck outpatient clinic participants subdivided intervention controlthe classicalmusicspring four seasons vivaldi interventionthe statetrait anxiety inventory stai collectioninstrumentalong inventory sociodemographic verify intragroup intergroup statistical significance participants presented statistically reduction perceived anxiety pas well pressure pulse respiratory conclusion music proven effective nonpharmacological therapeutic resource managinganxiety outpatient setting people well reducing pressure pulse respiratory brazilian registry rbrwyjj ambulatory facilities anxiety head neck music,1
11489,122219,Recenti progressi in medicina,29493642,decision aid informed decision screening donnainformatamammografia project italy invited populationbased bc screening physicians policy makers associations agree need inform benefits harms order permit informed decision decision aids da effective way support people decisions aims assess informed choices according literacy values participating bc screening benefits harms controversies presented contents da developed basis findings focus four interviews organized italian screening centers literature webbased platform developed implement da multilevel model impact da evaluated week followup da standard brochure via web invite obtain final sample size informed choice measured via knowledge attitudes intentions bc screening participation decisional conflict process informed choice reached web da open source could implemented bc screenings model could applied settings screenings decision making decision support techniques focus knowledge attitudes practice literacy interviews topic italy mass screening,1
11491,122236,"Voprosy kurortologii, fizioterapii, i lechebnoi fizicheskoi kultury",29786678,feasibility early application means physical rehabilitation view improvement presenting postmastectomy syndrome problem rehabilitation improvement postmastectomy syndrome holds important place modern concept proposed personalityoriented program physical rehabilitation practice relevant specialized departments improvement presenting postmastectomy syndrome benefits early physical rehabilitation inpatients became apparent within six onset training follows better performance physical social emotional functions estimated taking consideration subscales hand disorders comprising main comparison second main difference amounted р р р р points improvement social emotional state persisted postmastectomy syndrome undergone radical mastectomy described madden followed postoperative fifty examined inpatients whereas remaining ones outpatients regular medical checkup average inpatients randomly subdivided main comparison dispensary observations also allocated second main depending choice personalityoriented program physical rehabilitation carried beginning outpatient rehabilitation within initiation making standardized functional assessment factb questionnaire objective present determine purposefulness early application available means methods physical rehabilitation improvement presenting postmastectomy syndrome postmastectomy syndrome rehabilitation feasibility mastectomy surveys questionnaires syndrome,1
11546,123335,Annals of palliative medicine,27121737,impact psychosocial intervention metaanalysis identified articles thirteen benefit intervention ratio confidence interval difference detected four among benefit psychosocial interventions difference four groupdelivered interventions benefit favouring intervention difference four individuallydelivered interventions benefit four main groupdelivered treatments psychosocial interventions demonstrated shortterm improvements individuallydelivered interventions failed show benefit future longer followup warranted investigate longterm outcomes impact psychosocial interventions remains controversial metaanalysis recent literature conducted evaluate potential benefit psychosocial interventions medline embase cochrane central searched january outcomes receiving psychosocial intervention receiving interventions endpoints fouryear subgroup analyses compare groupversus individuallydelivered interventions assess canceronly psychosocial intervention metaanalysis prognosis psychosocial support systems topic,1
11553,123385,American journal of public health,17329652,effective lay worker outreach mediabased education promoting cervical screening among vietnamese american intervention motivated vietnamese american obtain pap tests become uptodate media education alone testing among intervention mediaonly intervention among never previously screened intervention mediaonly obtained tests intervention obtained pap test obtained interval became uptodate mediaonly recruited vietnamese american lay worker outreach plus mediabased education intervention mediabased education lay workers met intervention twice promote papanicolaou pap testing questionnaires measure changes awareness knowledge pap testing sought promote cervical screening among vietnamese american santa clara county calif asian americans california community workers communityinstitutional relations education knowledge attitudes practice mass media mass screening papanicolaou test acceptance program evaluation surveys questionnaires uterine cervical vaginal smears vietnam,1
11575,123554,International journal of chronic obstructive pulmonary disease,30584292,preliminary comparative volume slow fast deepbreathing techniques pulmonary function respiratory muscle strength oxidative stress cytokines minute walking distance persons copd device sdbt fdbt pulmonary function respiratory muscle strength oxidative stress cytokines walking capacity qol people copd oxidative stress status antioxidant capacity tac glutathione gsh malondialdehyde mda nitric oxide inflammatory cytokines necrosis factoralpha tnfα minute walking distance mwd copd questionnaire ccq score evaluated training tnfα ccq score differed fdbt postexperimental period sdbt device via fast deep breathing possibly improved respiratory muscle strength qol reduced inflammatory cytokines mda better via slow deep breathing among people copd minute walking distance copd cytokines incentive spirometry oxidative stress biomarkers breathing exercises cytokines equipment design exercise tolerance forced expiratory volume inflammation mediators volume measurements muscle strength oxidative stress predictive value tests preliminary pulmonary chronic obstructive recovery function respiratory muscles spirometry surveys questionnaires thailand vital capacity walk test biomarkers cytokines inflammation mediators,1
11616,123990,Reviews on recent clinical trials,30457055,hair loss prevention scalp cooling device early poliambulanza preliminary experience among identified accepted device eligible regimens docetaxelcyclophosphamide tc doxorubicincyclophosphamide ac paclitaxel weeklytrastuzumab pts completed pts ac prematurely interrupted scalpcooling device due inefficacy last cycle number perceived hl hair retention reported operators well tolerated scalpcooling device reduced chemotherapyinduced alopecia taxane furthermore suggests discordance hair loss perception operators effective common side hair loss reported reduction hair loss scalp cooling device indeed decreases accumulation hair follicles report preliminary experience scalp cooling device reducing chemotherapyinduced alopecia distress undergoing adjuvant hair loss grading tolerability evaluated every last cycle via scale operators comfort analogic scale administered hospital anxiety depression scale questionnaire baseline end assess distress induced alopecia anxiety distress hair loss scalp cooling alopecia protocols cryotherapy satisfaction assessment scalp,1
11622,124151,Anticancer research,29599363,ω fatty acid supplementation bile duct pancreatic undergoing omega fatty acid supplementation unresectable pancreatic bile duct improve cachexia racol enteral nutrient formulated omega fatty acids administered unresectable pancreatic bile duct skeletal muscle mass test taken preadministration pancreatic given digestive enzyme supplement lipacreon fifth week start skeletal muscle mass start preadministration omega fatty acids improve cachexia pancreatic bile duct pancreatic commonly suffer exocrine pancreatic insufficiency ingestion digestive enzyme supplements improve absorption biliarypancreatic cachexia omega fatty acids albumins protocols bile duct cachexia camptothecin modality deoxycytidine dietary supplements combinations fatty acids omega fluorouracil leucovorin nutritional support organoplatinum compounds oxonic acid paclitaxel pancreatic pyridines tegafur nm albuminbound paclitaxel albumins combinations fatty acids omega organoplatinum compounds pyridines tegafurgimeraciloteracil deoxycytidine tegafur oxonic acid gemcitabine paclitaxel leucovorin fluorouracil camptothecin,1
11626,124239,Anticancer research,31892604,recent advances understanding role vitamin reducing supplementation allcancer incidence mortality rates selected subgroups thus criteria causality biological system largely satisfied supporting claim vitamin reduces incidence death hydroxyvitamin mendelian randomization uvb colon ecological ultraviolet dietary supplements observational topic topic vitamin vitamin,1
11634,124402,Asian Pacific journal of cancer prevention : APJCP,29801402,peer leaders phone prompts implications practice among college students background compliance selfexamination bse guidelines helps detect early increasing physical activity decreases finding ways early initiate maintain behavior among youth therefore important aimed determine promotion education interventions knowledge attitude well practice bse physical activity college students materials methods students ten colleges underwent kinds education strategies namely traditional education program thep tapping peer leaders mobile phone prompts pphep improvement knowledge attitude shown interventions equally practice bse maintenance recommended level physical activity conclusion increase knowledge attitude practice bse improvement level exercise thep pphep interventions education peers mobile phone prompts offers alternative effective way promoting bse acceptable exercise selfexamination knowledge mobile phone prompts selfexamination casecontrol phone followup education knowledge attitudes practice promotion peer prognosis students universities,1
11726,125396,Minerva medica,30022644,complex nursing intervention cam increase satisfaction complementary therapies satisfaction young,1
11774,127019,Leukemia & lymphoma,25330445,early discharge safe feasible evaluation home singlecenter nonrandomized examine safety feasibility early discharge undergoing consolidation acute leukemia autologous stem transplant lymphoma multiple myeloma discharged ambulatory last subsequently seen ambulatory unit times week hundred ineligible program mostly medical situation lack caregiver travel hospital remaining able spend home cycles never readmitted demonstrates safety feasibility benefits managing carefully selected caregivers felt safe comfortable home vast majority preferred home inhospital infectious complications ambulatory chemotherapeutic approaches nursing protocols casecontrol doseresponse relationship feasibility followup hematologic home services staging discharge readmission prognosis,1
11853,127473,Journal of pain & palliative care pharmacotherapy,25102038,palliative biliary adenocarcinomas dimethyl sulfoxidesodium bicarbonate infusion sadenosyllmethionine adenocarcinoma gallbladder cholangiocarcinoma account gastrointestinal cancers biliary tract poor prognosis current available modalities pilot openlabel authors investigated safety dimethyl sulfoxidesodium bicarbonate dmsosb infusion sadenosyllmethionine ademetionine oral supplementation palliative pharmacotherapy nine nonresectable biliary tract carcinomas abtcs evidence biliary obstruction serum bilirubin μmoll allowed join month followup nine abtc indicated investigated improved biochemical parameters moreover method led month progressionfree investigated well tolerated without major adverse reactions given abtc highly fatal malignancy poor targeted drugs authors consider dmsosb ademetionine deserves research application palliative survivalenhancing adenosylmethionine biliary tract cholangiocarcinoma dimethyl sulfoxide sodium bicarbonate adenocarcinoma oral biliary tract dimethyl sulfoxide infusions intravenous management palliative sadenosylmethionine sodium bicarbonate sadenosylmethionine sodium bicarbonate dimethyl sulfoxide,1
11874,128128,Deutsches Arzteblatt international,30518470,invitation screening colonoscopy population familial additional counseling nurses telephone increase participation approaching crc opportunity increase participation firstdegree relatives screening colonoscopy frequency neoplasia found underscores need screen relatives even reach usual threshold screening screening colonoscopy lower incidence crc yet participation rates even goal double participation screening colonoscopy among persons familial determine frequency neoplasia nationwide clusterrandomized multicenter firstdegree relatives fdr crc across germany written informational materials concerning familial crc along invitation undergo colonoscopy participants intervention additionally counseled nurses telephone endpoint colonoscopy uptake within colonoscopy uptake rates intervention confidence interval polypectomy asymptomatic persons neoplasia detected persons colon stages participants expressed barriers colonoscopy reported mild side serious side colonoscopy counseling early detection germany promotion mass screening compliance participation sex telephone,1
11907,129014,International journal of environmental research and public health,30248943,week online walking intervention survivors quasirandomized baseline week threemonth followup irrespective allocation pedometer interventions delivered without online support step goal setting show promise improving survivors least short term intervention pedometer physical activity survivor walking survivors exercise followup promotion internet assessment rural telemedicine walking,1
11908,129017,International journal of environmental research and public health,30654534,mindful learning improves feelings family caregivers feelings important dimension family caregivers aim investigate whether langerian mindfulness valid proactive method increase feelings family caregivers participants randomly assigned either mindfulness mindlessness completed caregiver reaction assessment cra measure feelings intervention subsequently given four sessions mindfulness training innovation classification finally participants completed langer mindfulness scale lms aspects caregiving pac scale postintervention measures revealed participants mindfulness mindlessness differed lms pac scores mindfulness feelings mindlessness also indicated mindfulness level predicted feelings caregivers thus mindful interventions play meaningful role promoting family spirituality faith improving willingness sharing thoughts beliefs grief could useful increasing feelings caregivers family caregivers mindfulness feelings caregivers emotions learning mindfulness,1
11922,129440,"International journal of radiation oncology, biology, physics",10348277,psychoeducational increases vaginal dilation younger reduces sexual fears ages gynecological younger attending experimental program likely recommendations vaginal dilation intervention regardless experimental intervention reported less fear sex older experimental intervention gained sexual knowledge evidence experimental intervention improved global sexual thirtytwo cervical endometrial either experimental program intervention consisted written information brief counseling measures global sexual knowledge sexuality fears sexuality vaginal dilation compliance association gynecological sexual dysfunction well established regular vaginal dilation widely recommended way maintain vaginal good sexual functioning compliance recommendation purpose test effectiveness psychoeducational program informationmotivationbehavioral skills model behavior change increasing compliance provide evidence effectiveness increasing vaginal dilation following gynecological reducing fears sex particularly younger unlikely recommendation dilate unless given assistance overcoming fears taught behavioral skills variance coitus dilatation dyspareunia endometrial fear longitudinal compliance education topic program evaluation radiation injuries uterine cervical vagina,1
11928,129452,Cancer practice,10352065,increasing mammography practice african american witness project participants practice selfexamination mammography counties demonstrate intensive communitybased culturally sensitive educational programming incorporating spiritual environment faith community witness project positively influence screening behaviors among rural underserved african american community churches survivors screening activities improved population examines effectiveness witness project culturally competent education program trains survivors promote early detection selfexamination mammography population rural underserved african american setting witness projectan intensive communitybased culturally sensitive educational program incorporates spirituality faithwas african american church baseline month followup surveys obtained african american intervention counties african american counties rural mississippi river delta region arkansas african americans arkansas community workers education knowledge attitudes practice mammography medically underserved area pastoral acceptance program evaluation rural survivors,1
11969,129642,"Current oncology (Toronto, Ont.)",30607117,reducing postsurgical exudate san huang decoction ameliorate inflammatory status reducing inflammatory wound exudate promising approach healing wounds postsurgical traditional chinese medicine tcm treatments shown beneficial safe optimal regulation oxidative stress postoperative period present evaluated effectiveness promising chinese herbal formula san huang decoction shd radix astragali radix et rhizoma rhei rhizoma curcuma longa supplemental table wound inflammatory mastectomy liquid shd taken twice daily without food given postoperatively participants placebo schedule outcomes measured every subject tcm wound inflammation symptom scores daily amounts drainage fluid inflammatory exudate tumour necrosis α tnfα interleukins r ilr human creactive protein crp postoperatively tnfα ilr crp drainage fluid lower shd perioperative shd effectively lessened postoperative exudate ameliorated inflammatory symptoms underwent san huang decoction traditional chinese medicine complementary medicine exudate flaps inflammation inflammatory tcm antiinflammatory biomarkers casecontrol drugs chinese herbal exudates transudates inflammation mastectomy medicine chinese traditional postoperative complications antiinflammatory biomarkers drugs chinese herbal sanhuang,1
12041,130276,Zhonghua zhong liu za zhi [Chinese journal of oncology],29502373,postoperative precision nutrition postoperative recovery gastric neoadjuvant postoperative precision nutrition improve postoperative nutritional status shortterm agc nc indirect energy determination neoadjuvant nutrition stomach albumins body mass index creactive protein calcitonin energy intake energy metabolism hospitalization lymphocyte count neoadjuvant nutrition assessment nutrition nutritional status postoperative recovery function stomach albumins calcitonin creactive protein,1
12044,130353,Zhonghua yi xue za zhi,31434413,intervention biofeedback pelvic floor muscle exercise anterior resection syndrome anuspreserving rectal biofeedback training pelvic floor muscle exercise improve sensory indicators midlow rectal promote recovery intestinal function alleviate anterior resection syndrome rectal worthy popularization application bowel function functional exercis anterior resection syndrome lars rectal cacer sphincter preservation operation anal canal biofeedback psychology exercise fecal incontinence manometry muscle skeletal pelvic floor postoperative complications rectal syndrome,1
12055,130581,Image--the journal of nursing scholarship,10380385,home psychosocial status collected structured interviews administered discharge approximately later psychosocial status measured caregiver reaction assessment cesdepression scale repeatedmeasures variance psychosocial measure ie interview caregiver physical problem psychosocial status improved baseline among caregivers physical problems psychosocial status declined discharge opposite pattern following longitudinal sample caregivers large university hospital northeastern united states half randomly assigned receive standardized homecare nursing intervention population interest caregivers diagnosed solidtumor within past older c hospitalized surgical expected live least complex problem hospital discharge caregivers living discharge examine changes psychosocial status caregivers postsurgical status affected whether caregivers physical problems whether home intervention many area date sufficient measurement points identify fluctuations psychosocial status addition many caregiver rather predictor people caregivers physical problems psychologic morbidity delayed onset delay reflect replacement initial optimism discouragement reality longterm illness sets home create situation caregivers required confront realities longterm caregiving quickly cutting short initial optimism also preparing come variance caregivers depression interviews topic longitudinal postoperative period,1
12244,132385,Journal of cancer research and therapeutics,30880749,exercise prehabilitation program neoadjuvant rectal pilot exercise might effective prehabilitation strategy period ncrt prehabilitation emerging method preparing physically mentally often disabling aims assess feasibility explore potential prehabilitation program consisting educational physical exercise sessions rectal undergoing neoadjuvant chemoradiotherapy ncrt pilot males females handgrip dynamic leg strength physical activity pa measured reported standard deviation medians interquartile ranges questionnairederived secondary measures nonparametric wilcoxon test threshold value significance calculated correction multiple comparisons bonferroni method intervention together reduced scores depression qol domain emotional function moderate vigorous pa tended increase exercise program oncology physical activity chemoradiotherapy exercise neoadjuvant compliance pilot projects preoperative rectal,1
12284,132753,Epidemiology and health,31208191,prevention education program elementary school knowledge attitude selfefficacy intentions south korea children adolescents knowledge awareness infrequently engage preventive behaviors examined short classroombased intervention prevention knowledge attitude toward preventability selfefficacy behavioral intentions fifthgrade elementary school students longterm regular booster sessions required improve socialcognitive also behavioral intentions could result behavior changes promoting prevention month postintervention revealed partial indicating education intervention improved knowledge attitudes toward preventability selfefficacy behavioral intentions intervention prepostfollowup quasiexperimental design participants intervention attended minute sessions prevention education watched music video prevention participants exposed music video selfreported knowledge attitude toward preventability selfefficacy behavioral intentions assessed week preintervention postintervention well postintervention prevention education elementary school program evaluation quasiexperimental design child education knowledge attitudes practice intention program evaluation republic korea schools self students,1
12293,133022,American journal of health promotion : AJHP,17375492,impact intervention cancerrelated behaviors among workingclass multiethnic community center intervention number six possible intervention components completed participant changes fruit vegetable consumption red meat consumption physical activity multivitamin intake baseline month followup baseline sample determined examine relationship intervention behavior change healthy directionshealth centers intervention designed reduce design intervention condition participant bivariate multivariate associations intervention change behaviors examined components clinician endorsement inperson counseling session four telephone counseling sessions trained advisor socialcontextual tailored materials multivariate association intervention increase multivitamin intake approached significance seventy percent participants completed intervention activities bivariate completion four telephone counseling calls decrease red meat consumption findings indicate future examine number content length contacts needed behavior change also suggest centers channel reaching diverse populations shown level intervention implementation residing lowincome workingclass multiethnic neighborhoods community centers massachusetts community services counseling diet ethnic behavior promotion motor activity poverty process assessment,1
