,Unnamed: 0,journalname,pmid,text,response
7088,79317,The journal of nursing research : JNR,29360672,psychoeducational intervention undergoing conducted randomly assigned either experimental experimental participated pei brief highly structured program consisting parts educational manual addressed depression anxiety diseasespecific knowledge selfefficacy resilience selfassessment learning traditional pamphlet education collected four points session third session fifth session final session facetoface pei potentially effective improving knowledge resilience current pei improved techniques reduced chemotherapyrelated discomfort improved participants experimental compelling evidence yet published regarding psychoeducational interventions peis psychological distress impact peis selfefficacy resilience also unclear aim assess pei anxiety depression diseasespecific knowledge selfefficacy resilience intervention administered five rounds anxiety depression resilience experimental differences differences became apparent knowledge selfefficacy knowledge resilience remained interactions model showing relationship pei variables knowledge resilience anxiety depression knowledge attitudes practice psychotherapy resilience psychological self young,1
7089,79318,The journal of nursing research : JNR,30395021,acupressure elevating stem gynecologic posttest hemoglobin decreased sd mgdl pretestposttest difference hemoglobin concentration mgdl detected experimental scf pretest posttest acupressure addition borderline difference pretestposttest scf increase found acupressure finally timedependent interactive found acupressure level scf posttest β gynecological randomly assigned either experimental experimental acupressure minute duration hegu li quchi li xuehai sp sanyinjiao sp taixi k zusanli st taichong lr baihui gv points times receive acupressure intervention count including white platelets hemoglobin serum scf granulocytemacrophage colonystimulating assessed pretest posttest course aims evaluate effectiveness noninvasive acupressure preventing diminishing chemotherapyinduced myelosuppression gynecologic determine whether regulation expressions granulocytemacrophage colonystimulating stem scf mainly treat gynecological bone marrow suppression adverse side decrease immune function increasing serious fatal infections findings support acupressure specific acupoints increases scf help protect experiencing reduced hemoglobin relieve chemotherapyinduced myelosuppression gynecologic noninvasive approach suggested practical implementation undergoing course acupressure genital leukemia myeloid acute stem taiwan stem,1
7133,80851,Medicine,30572473,nerve electrical stimulation treating chemotherapyinduced nausea vomiting gastric nes greater effectiveness reducing severity nausea vomiting well appetite improvement sham nes furthermore adverse events nes detected hundred twentyfour eligible agc equally divided nes sham nes nes intervention subjects sham underwent sham nes symptoms severity appetite secondary outcomes measured anderson symptom inventory mdasi score functional impairment evaluated karnofsky score additionally adverse events also documented period evaluated effectiveness nerve electrical stimulation nes chemotherapyinduced nausea vomiting cinv gastric agc demonstrated nes help relieve cinv agc future still needed warrant appetite electric stimulation nausea severity illness index stomach transcutaneous electric nerve stimulation vomiting,1
7134,80918,Medicine,30813149,oral glutamine supplements reduce concurrent chemoradiotherapyinduced esophagitis nonsmall september september diagnosed nsclc thirty prophylactic powdered gln orally g h prescribed radiation planning target volume gy gy fractions endpoints radiationinduced esophagitis mucositis body weight loss progressionfree complications concurrent chemoradiotherapy ccrt acute radiationinduced esophagitis arie cause morbidity unplanned delays nonsmall nsclc designed assess impact glutamine gln supplementation preventing ccrtinduced toxicities nsclc suggests beneficial oral glutamine supplementation prevention radiationinduced injury body weight loss nsclc receiving ccrt nsclc men standard deviation range yearsat followup range tolerated gln well gln decrease incidence arie gln gln gln supplementation appeared delay arie onset reduced incidence weight loss nonsmallcell chemoradiotherapy dietary supplements esophagitis glutamine incidence radiation injuries dosage glutamine,1
7135,80934,Medicine,30817604,responses survivors undergoing gamma knife supportive psychotherapy increasingly important concern clinicians cancers psychological problems present examined supportive psychotherapy sgp anxiety depression undergoing gamma knife gks undergoing gks randomly divided sgp usual cau sgp psychotherapy intervention week cau usual measures administered intervention followup measures item hospital anxiety depression scale hads secondary measures item european organisation research questionnairecore eortc qlqcdemographic characteristics sgp cau difference sex course education marital status profession psychological characteristics evaluated hads revealed depression anxiety sgp improved cau end improvement remained followup addition eortc qlqc demonstrated functional scales including emotion cognition society sgp cau end maintained till followup eortc qlqc also symptom scales including fatigue nauseavomiting syspnea insomnia loss appetite financial problems former lower latter maintained till followup furthermore sgp variables hads eortc qlqc obvious improvement followupthe suggested sgp alleviate anxiety depression following gks improve anxiety survivors depression fatigue mental psychotherapy radiosurgery socioeconomic,1
7136,80965,Medicine,30985703,effectiveness safety economic evaluation topical application herbal ointment jaungo radiation dermatitis conserving green protocol statistically logrank test estimating curve kaplanmeier method continuous variables tested independent test mannwhitney u test adverse events evaluated chisquare fisher exact test analyzed significance level twosided r software r foundation openlabel parallelgroup evaluates effectiveness safety adjuvant application jaungo jug radiationinduced dermatitis rd undergoing radiation comparison general supportive gsc eighty diagnosed unilateral allocated either jug gsc allocation ratio conservation kyung hee university korean medicine hospital seoul republic korea subjected gsc jug participants apply adjuvant jug ointment irradiated skin twice assessment incidence rd radiation oncology rtog gradation maximum level adverse reactions pharmacoeconomic evaluations also cris research information service kct february abdominal protocols dermatologic drugs chinese herbal ointments selection phytotherapy radiationprotective radiodermatitis young dermatologic drugs chinese herbal ointments radiationprotective jaungo,1
7137,81059,Medicine,31277176,cognitive behavioral psychological adjustment chinese pediatric receiving prior intervention ability psychological adjustment difference intervention cdrisc score whereas scores depression anxiety stress obviously lower cbt moreover decline negative mood score yolk sac children evident cbt resilience changes children obvious cbt effectively help chinese pediatric modify distorted cognition attitude towards enhances resilience relieves negative mood good psychological adjustment ability especially yolk sac beneficial better cooperation longterm hundred four chinese pediatric receiving divided cbt randomly equally resilience negative mood applied evaluate ability psychological adjustment pa connerdavidson resilience scale cdrisc depression anxiety stress scale dass employed measure resilience negative mood intervention spss software analyze cognitive behavioral cbt widely pediatric promote psychological adjustment pa considering diversity region culture china chinese population well defined therefore explore cbt improving pa chinese pediatric receiving adolescent affect asian continental ancestry child china cognitive behavioral emotional adjustment resilience psychological,1
7138,81096,Medicine,31415396,medium chain triglycerides body fat distribution adipocytokine children acute lymphoblastic leukemia glucocorticoids treat acute lymphoblastic leukemia cytotoxicity obesity aim investigate highproportion medium chain triglyceride mct body fat distribution leptin adiponectin children allnewonset children guangzhou medical center march march enrolled children divided mct mct highproportion mct nutrition preparation added diet mct added mct divided subgroups amount supplement waist circumference hip circumference waisttohip ratio bone marrow concentrations leptin adiponectin leptintoadiponectin ratio measured body weight body mass index bmi measured admission dischargewaist circumference change mct bmi children mct admission different discharge differences hip circumference leptin adiponectin body weight groupsthis preliminary suggests shortterm supplementation highproportion mct nutrition preparation help reduce centripetal distribution adipose induced application glucocorticoids children confirmed future adiponectin adiposity body fat distribution body mass index body weight child child preschool dietary supplements glucocorticoids leptin obesity precursor lymphoblastic leukemialymphoma triglycerides waist circumference adipoq protein human adiponectin glucocorticoids leptin triglycerides,1
7139,81177,Medicine,31860946,assessment chinese patent medicine treating caused protocol systematic development economy acceleration population aging pca presented situation morbidity mortality worldwide recent shown chinese patent medicine endocrine plays synergistic role enhancing hopes adopt metaanalysis evaluate safety chinese patent medicine caused provides evidence application practice search pubmed cochrane library amed embase worldscinet nature science online china journal fulltext database cnki china biomedical literature cdrom database cbm china resources database limited construction library june criteria provided cochrane assessment assessment revman stata software metaanalysis effectiveness symptom scores caused prospero crd systematic evaluate safety chinese patent medicine caused systematic metaanalysis published require ethical approval furthermore analyzed anonymously process china diseasefree medicine chinese traditional local management measurement prostatic assessment,1
7152,81681,Pancreas,30325865,chromogranin followup gastroenteropancreatic neuroendocrine really game systematic metaanalysis little known chromogranin cga followup gastroenteropancreatic neuroendocrine hypothesized serial cga monitoring might useful assessment systematic literature metaanalysis bibliographical search pubmed chromogranin neuroendocrine tumors followup biomarker identify pertinent articles published last eight current metaanalysis chromogranin followup marker shows sensitivity specificity metaanalysis accuracy confidence interval cumulative sensitivity cumulative specificity indicate circulating cga better accuracy followup setting rule diagnosis recurrenceprogression rather rule chromogranin reliable monitor early detection rather diagnostic setting sensible marker initial values impaired biomarkers chromogranin followup intestinal neuroendocrine tumors pancreatic sensitivity specificity stomach biomarkers chromogranin,1
7153,81684,Pancreas,30589829,progressive resistance training impact physical fitness body weight pancreatic analyzed adherence rates rt rt prescribed training sessions rt improvements elbow flexorextensor muscle strength maximal work load con rt knee extensors improved rt con body weight revealed differences progressive rt feasible pc improved muscle strength muscle supervised rt seemed effective homebased rt maintaining improving muscle mass muscle strength important goal pancreatic pc cachexia therefore assessed feasibility effectivity month progressive resistance training rt pc within sixtyfive pc randomly assigned either supervised progressive rt rt homebased rt rt usual con exercise training times week muscle strength knee elbow hip extensors flexors cardiorespiratory fitness body weight assessed intervention period body weight exercise exercise muscle strength muscle skeletal pancreatic physical fitness resistance training,1
7157,81779,Journal of pediatric hematology/oncology,29309374,evaluation serum trace element vitamin children diagnosis adequate nutrient intake provided cure children diagnosed aim evaluate serum trace elements vitamins children diagnosis children newly diagnosed admitted center evaluated serum selenium iron ferritin creactive protein vitamin folate oh vitamin presentation third sixth fortytwo children malefemale range serum folate iron within normal ranges selenium oh vitamin presentation month period serum ferritin measures decreased sixth month relation micronutrient deficiency sex place residence conclusion serum trace element vitamin deficiencies common children need larger series adolescent avitaminosis creactive protein child child preschool followup selenium trace elements vitamins trace elements vitamins creactive protein selenium,1
7163,81894,Cancer nursing,25010250,decision aid support informed choices recently diagnosed decision aids provide balanced information benefits risks options improve match preferences assess impact decision aid regarding options localized arm compare booklet decision aid intervention standard information localized conducted hospitals main measures knowledge decisional conflict satisfaction decisionmaking process coping respective decisional conflict scale scores intervention intervention knowledge scores intervention satisfaction decision scale scores intervention decision aid improved knowledge localized satisfaction decision making also decreased decisional conflict decision aid represents rather innovative approach insurance fund develop offer format information decision support opens new field nurses empower decisionmaking process develop new roles area decision making decision support techniques followup knowledge attitudes practice invasiveness staging participation preference prostatic assessment,1
7164,81941,Cancer nursing,28437283,dilator vaginal brachytherapy endometrial feasibility adherence aims assess feasibility recruitment dilator test theoretically driven enhanced educational program eep increase adherence eligible consented completed month assessment sexually active difference adherence arms adherent prescribed times week adherent least week adherence greater among motivated vaginal lower body mass index nonadherence among college educated eep weight nursing education includes dilators maintain vaginal improve motivator adherence feasibility recruitment vaginal dilator adherence difference adherence vaginal dilator requires novel interventions test vaginal brachytherapy common endometrial rates vaginal stenosis recommendations vaginal dilator minimize stenosis generally include times week approximately adherence rates range widely generally well less eligibility postoperative vaginal brachytherapy iiic endometrial either nursedelivered standard institutional instruction eep adaptation psychological brachytherapy dilatation endometrial compliance radiation injuries sexual behavior vagina,1
7165,81946,Cancer nursing,28926349,nurseled program center singlecenter openlabel arm parallel equal randomization hong kong randomly allocated intervention arm arm arm routine hospital intervention arm nurseled plus routine hospital selfefficacy symptom distress satisfaction evaluated questionnaires randomization month individual interviews conducted participants intervention arm intervention arm participants reported lower distress oral problems fatigue peripheral neuropathy distressful feelings satisfaction according satisfaction evaluation interviews participants stated service helpful providing information communication opportunities filling service gap providing psychological support relieving discomfort building confidence aim examine nurseled program receiving outpatientbased nurseled program could applied hospitals hong kong exploring applicability settings countries recommended healthcare providers facing challenge helping cope impact outpatientbased nurseled program proposed address challenge support provision comprehensive continuous individualized medical hong kong nursing evaluation research practice patterns,1
7173,82503,Clinical nuclear medicine,31274608,preventive parotid gland massage salivary gland dysfunction highdose radioactive iodine differentiated thyroid evaluate preventive parotid gland pg massage pg damage prospectively investigated serum amylase value salivary gland scintigraphy sgs hundred thyroidectomized differentiated thyroid underwent highdose enrolled pg massage nonmassage serum amylase value obtained sgss also taken change serum amylase value sgs pg massage nonmassage pg gland massage reduced incidence rates salivary gland dysfunction month fu sgs level serological marker salivary gland destruction therefore pg gland massage could alleviate salivary gland damage difference value serum amylase lower pg massage nonmassage worsening pg function sgs incidence pg abnormality fu sgs lower pg massage nonmassage odds ratio multiple regression pg massage affected abnormality month fu sgs rpartial adjusting variables sex tnm tsh preparation methods iodine radioisotopes massage parotid gland radiation injuries dosage salivary glands thyroid young iodine radioisotopes,1
7203,83577,Asia-Pacific journal of clinical oncology,28857425,strainspecific probiotic microbial preparation omega fatty acid modulating inflammatory markers usually elevated inflammatory markers experience numerous side thereby leading poor omega fatty acid microbial preparation mcp known provide benefits aim determine supplementation omega fatty acid mcp side inflammatory markers doubleblind carried subjects separated receive either placebo mcp billion colonyforming unit cfus sachet sachets daily omega fatty acid g daily outcomes measured side inflammatory markers interleukin necrosis factorα tnfα creactive protein supplementation mcp omega fatty acid improved alleviated certain side supplementation mcp omega fatty acid also managed reduce level rise placebo serum tnfα supplementation mcp omega fatty acid improve reduce certain inflammatory biomarkers relieve certain side inflammatory markers omega fatty acid strainspecific probiotic doubleblind method fatty acids omega probiotics fatty acids omega,1
7209,83864,Asian journal of endoscopic surgery,29575594,preoperative weight loss program involving lowcalorie diet obesity laparoscopic gastrectomy gastric preoperative lowcalorie diet weight loss program promising obesity laparoscopic gastrectomy gastric achieved weight loss confidence interval corresponding body fat mass decreased whereas skeletal muscle mass unaffected visceral fat mass reduction range underwent laparoscopic gastrectomy planned severe postoperative morbidity claviendindo seen waist circumference men underwent preoperative lowcalorie diet nutritional counseling weight loss body composition visceral fat mass operative outcomes evaluated visceral fat obesity increase technical difficulty evaluate preoperative lowcalorie diet obesity laparoscopic gastrectomy gastric gastrectomy obesity weight loss programs body mass index caloric restriction gastrectomy laparoscopy obesity obesity morbid stomach weight loss weight reduction programs,1
7215,84445,British journal of health psychology,30852854,couplefocused interventions men localized spouses partners randomly assigned receive iet ghw uc participants completed measures psychological functioning relationship satisfaction baseline postbaseline outcomes psychological adjustment depression cancerspecific distress concerns relationship satisfaction couplefocused interventions improved psychological relationship functioning among men diagnosed localized spouses impact intimacyenhancing iet general wellness intervention ghw usual uc psychological relationship functioning localized partners relationship length relationship satisfaction masculinity evaluated moderators arms four assessment points intimacyenhancing show impact general cancerspecific distress show early impact relationship satisfaction among spouses iet superior uc longer relationships important researchers understand couplefocused interventions benefits spouses identify characteristics partners couples benefit psychological treatments statement contribution already known subject men diagnosed localized report lower healthrelated spouses report elevated distress relationship communication plays role psychological adaptation couplefocused interventions illustrated impact relationship communication comparing different couplefocused interventions add intimacyenhancing superior comparison broad range psychological relationship outcomes intimacyenhancing superior longerterm relationship general wellness intervention beneficial men shorter relationships men endorse traditional masculine norms spouses iet greater increases relationship satisfaction spouses ghw uc baseline week followup among longer relationships increases psychological adjustment found treatments uc among spouses longer relationships psychological adjustment iet uc declined ghw general wellness intervention intimacyenhancing psychological intervention adaptation psychological couples personal satisfaction prostatic spouses,1
7218,84584,BJU international,30239116,immediate delayed exercise men initiating androgen deprivation bone density soft tissue composition commencing exercise onset adt preserves lumbar spine bmd muscle mass muscle density avoid treatmentrelated adverse musculoskeletal exercise medicine prescribed commenced onset adt whole body spine hip bmd progressive loss imex del although lumbar spine bmd largely preserved imex del lm asm muscle density preserved imex declined del recovered training fm trunk fm month period imex del initiating adt randomised immediate exercise imex delayed exercise del conditions former consisted supervised resistanceaerobicimpact exercise latter comprised usual followed identical exercise programme regional whole body bmd lean mass lm whole body fm trunk fm appendicular skeletal muscle asm assessed dual xray absorptiometry muscle density peripheral quantitative computed tomography baseline examine whether efficacious commence exercise medicine men onset androgendeprivation adt rather later preserve bone softtissue composition adt adverse including reduced bone mineral density bmd loss muscle mass fat mass fm pcsm prostatecancer androgendeprivation exercise absorptiometry photon adipose tissue androgen antagonists hormonal body composition bone density exercise muscle skeletal prostatespecific antigen prostatic singleblind method testosterone tomography xray computed androgen antagonists hormonal testosterone prostatespecific antigen,1
7229,85398,European journal of cancer care,28833787,global supportive skin programme hydrotherapy nonmetastatic randomised investigated posttreatment hydrotherapy supportive management persistentlonglasting dermatologic adverse events daes induced survivors adjuvant impact qol complete remission standardised neoadjuvant infiltrating hrherbreast enrolled randomised multicentre completing cg best supportive hg specific hydrotherapy criterion change qol qlqbr hydrotherapy grading daes cancerrelated qol qlqc dermatologic qol dlqi general psychological wellbeing pgwbi assessed daes found inclusion items greater improvement hg cg qlqbr arm symptoms systemic side body image dae grading dlqi pgwbi xerosis inclusion completely healed hg specific hydrotherapy effective supportive highly prevalent longlasting daes occurring early including leads improved qol dermatologic toxicities survivors dermatologic adverse events hydrotherapy oncodermatology taxanes protocols aromatase inhibitors adjuvant cyclophosphamide docetaxel emollients epirubicin fluorouracil gonadotropinreleasing hormone handfoot syndrome hydrotherapy hyperpigmentation lymphedema manual lymphatic drainage massage mastectomy neoadjuvant pruritus radiodermatitis adjuvant skin skin diseases tamoxifen taxoids aromatase inhibitors emollients taxoids tamoxifen docetaxel gonadotropinreleasing hormone epirubicin cyclophosphamide fluorouracil,1
7230,85400,European journal of cancer care,28840622,propolis prevention oral mucositis receiving adjuvant pilot randomised chemoinduced oral mucositis om symptoms delays costs pilot randomised aimed evaluating safety tolerability compliance propolis receiving doxorubicin cyclophosphamide testing preliminary propolis prevention om prospectively evaluating incidence om sixty randomised receive either dry extract propolis galangin plus mouth rinsing sodium bicarbonate experimental arm mouth rinsing sodium bicarbonate arm om evaluated ncictcae v compliance tolerability propolis adverse events recorded incidence om also prospectively evaluated manifested suspected skin reaction propolis experimental arm developed om g arm om g incidence om g end cycles second fifth cycles propolis plus bicarbonate safe well tolerated promisingly effective prevention om adverse complementary therapies oral mucositis propolis antiinfective protocols adjuvant cyclophosphamide doxorubicin incidence pilot projects propolis stomatitis antiinfective doxorubicin cyclophosphamide propolis,1
